{
  "schemaVersion": 1,
  "network": "giwa-testnet",
  "chainId": 91342,
  "deployed": false,
  "contracts": {
    "protocolConfig": null,
    "launchFactory": null,
    "ammAdapter": null
  },
  "ammIntegration": {
    "kind": "forge-self-hosted-constant-product-testnet",
    "integrationApproved": false,
    "testOnly": true
  },
  "blocker": "No GIWA Sepolia broadcast has been authorized and no deployment addresses or receipts exist. The self-hosted adapter path is explicitly test-only and unaudited; deployment still requires a funded user-controlled key, final admin and fee inputs, simulation, explorer source verification, and a launch/buy/sell reconciliation smoke."
}
